{
  "$schema": "https://json-schema.org/draft/2020-12/schema",
  "$id": "https://github.com/jessn-dev/nock/pkg/format/schema.json",
  "title": "nock cheatsheet",
  "description": "Schema for a nock cheatsheet file. Authoritative Go definition lives in pkg/format/format.go; keep them in sync.",
  "type": "object",
  "required": ["name", "commands"],
  "additionalProperties": false,
  "properties": {
    "schema_version": {
      "type": "string",
      "const": "1",
      "description": "Cheatsheet schema version. Omit to accept the current version."
    },
    "name": { "type": "string", "minLength": 1 },
    "description": { "type": "string" },
    "author": { "type": "string" },
    "source": { "type": "string", "description": "Provenance, e.g. the URL a sheet was imported from." },
    "license": { "type": "string" },
    "commands": {
      "type": "array",
      "minItems": 1,
      "items": { "$ref": "#/$defs/command" }
    }
  },
  "$defs": {
    "command": {
      "type": "object",
      "required": ["id", "command"],
      "additionalProperties": false,
      "properties": {
        "id": {
          "type": "string",
          "minLength": 1,
          "description": "Stable unique identifier within the cheatsheet."
        },
        "name": { "type": "string" },
        "command": {
          "type": "string",
          "minLength": 1,
          "description": "Command template. Variables are written as <name>, e.g. 'nmap -sV <target>'."
        },
        "description": { "type": "string" },
        "intent": {
          "type": "string",
          "description": "Natural-language goal of the command. Primary signal for AI ranking."
        },
        "tags": { "type": "array", "items": { "type": "string" } },
        "risk": {
          "type": "string",
          "enum": ["info", "low", "medium", "high"],
          "description": "How destructive or detectable the command is."
        },
        "requires_auth": {
          "type": "boolean",
          "description": "Whether the command needs valid credentials to be useful."
        }
      }
    }
  }
}
